{"acquired_at":"2026-06-01T13:14:00Z","artifact_metadata":{"classification":"SYNTHETIC_FIXTURE","evidence_claim":"NOT_EVIDENCE_OR_PASS","fixture_notice":"SYNTHETIC EXAMPLE ONLY; NOT EVIDENCE; NOT A PASS VERDICT"},"attempt_id":"fixture-release-attempt-v2-001","attempt_input_set_ref":{"artifact_id":"fixture-release-attempt-input-set-v1","artifact_path":"contracts/fixtures/governance-models/valid/release-attempt-input-set.json","artifact_sha256":"8892d163821d5d78e2833ff3bfd3545c682efcb940ca4e32064a1b56dd727454","revision":1,"schema":"ylx.release-attempt-input-set.v1"},"attempt_terminal_slot":"release-terminal-slots/fixture-release-attempt-v2-001","authorizing_freshness_checkpoint_ref":{"artifact_id":"fixture-release-freshness-checkpoint-1","artifact_path":"contracts/fixtures/governance-models/valid/release-freshness-checkpoint-1.json","artifact_sha256":"108e04f76d27d7bd9c103350f723a0c0d186cd0cab50fe0d1488ca6f8814af0a","schema":"ylx.release-freshness-checkpoint.v1"},"authorizing_freshness_checkpoint_sequence":1,"binding_context_ref":{"artifact_id":"fixture-binding-context-v2-m5","artifact_path":"contracts/fixtures/governance-models/valid/binding-context-v2-m5.json","artifact_sha256":"763f34fcb78fae4d4de0473fe500220e7bec310d5f61799f7a44f378c27747e3","revision":1,"schema":"ylx.binding-context.v2"},"canonical_ga_target":"fixture-origin-v2/refs/tags/v0.5.0","canonical_remote_id":"fixture-origin-v2","contract_release_sha256":"ffeaf17fa88b81525de8bbffbfeaaff15900ea3661742d9b2eec086ef2f12300","domain_attestation_sha256_by_role":{"build-platform-owner":"23103f9af8e33a879436eb9cd5847e03a66c471d0bbba0ca108849629f8eb6f9","capture-owner":"0d96a399d66aa3c19fde57edbcf580c2295706a12cc60f5445af4cafc639faac","consumer-owner":"70cd5d8fad066a35cc3d1dd7fa073712872d81e8efebe3e0961e684d93eabb67","contract-owner":"cb5e61cc41468db6bebcebd9bec25933e655196c87bcb27d1f5b5aceff9a2cf3","hardware-owner":"605deab99072b3e47b063f8df9ae95ef320409b138089cd91fbe8c285b3f6688","network-owner":"fc64e1929506a6b43012bbc3cf3d4af53e41250ac513dc67b7bea7a14f49114d","pipeline-owner":"a625e64ec81ea6e678ff7cd3179d5ddfb4fc5d45028ea0def8b06d308818e3cf","qa-evidence-owner":"f61b71d2014afe4f724384a7eb730d5d26552ef16ebe977cd8e563948446146c","release-owner":"54498e9206ec6360d695fc826ab593fec3b5ba5fdcb02608c3f7cf949e197db3","security-owner":"cd0e1911699ea4b6a3696a175fec121691cce3498b3b4bd32ec256ed9f6d2574","web-control-owner":"cce3a24b317b85f8026328b7b45f27d45f785b1c026bf152dddbbc23c529084f"},"effective_m4_lineage_ref":{"artifact_id":"fixture-m4-context-lineage-v2","artifact_path":"contracts/fixtures/governance-models/valid/m4-context-lineage-r2.json","artifact_sha256":"11f6d820b383c384ca3ab18d8eb66098c90842747d5de89e54c2cef4f60aa63c","revision":2,"schema":"ylx.m4-context-lineage.v1"},"fence_authority_id":"fixture-release-fence-authority-v2","fence_id":"fixture-release-publication-fence-v2","fence_semantics":{"aborted_state":"ABORTED_REFERENCE_DURABLE","acquisition":"CREATE_IF_ABSENT_SINGLE_ATTEMPT","active_derivation":"TERMINAL_SLOT_ABSENT","emergency_revocation":"TERMINATE_ATTEMPT_AND_KEEP_GA_QUARANTINED","finalized_state":"FINAL_REFERENCE_DURABLE","ga_visibility":"QUARANTINED_UNTIL_VALID_ACTIVE_DISTRIBUTION_HEAD","missing_manifest_state":"RELEASE_NOT_COMPLETE","ordinary_authority_successors":"BLOCKED_WHILE_ACTIVE","orphan_final_payload_state":"FINAL_PAYLOAD_DURABLE_NOT_ACTIVATED","parallel_attempts":"FORBIDDEN","post_finalized_cas_pre_readback_freshness_mismatch":"IMMUTABLE_INVALID_TERMINAL_NO_PASS_NO_RELEASE_COMPLETE_NO_OVERWRITE_OR_REUSE","pre_finalized_cas_freshness_mismatch":"ABORTED_AND_QUARANTINED","recovery":"SAME_IMMUTABLE_INPUTS_ONLY","release_condition":"VALID_MANIFEST_AND_FINALIZED_SLOT_REFERENCE_DURABLE_EXACT_READBACK"},"fresh_issue_head":{"artifact_path":"valid/issue-register-head.json","head_artifact_sha256":"21cc6a6f329a16f6cb895725cc68392d9a8c9e0bd2aa7a146e8ea90b239a9805","overview_cardinality":1,"register_sha256":"7b441f0fb21a98dbf2f73363fd5e806011d5c872003b2167140a83c93100d5f3","revision":2,"selector_version":"issue-register-gate-selector.v1"},"ga_channel":"channels/ga/0.5","ga_ref":"refs/tags/v0.5.0","initial_customer_visibility":"QUARANTINED","key_head_ref":{"artifact_id":"fixture-signing-key-head-r1","artifact_path":"contracts/fixtures/governance-models/valid/signing-key-validity-revocation-head.json","artifact_sha256":"6fa9102b8171a57d0ae8179ad039e5ceb1fa81187b0b4e196989916ff834758f","revision":1,"schema":"ylx.signing-key-validity-revocation-head.v1"},"key_head_sha256":"6fa9102b8171a57d0ae8179ad039e5ceb1fa81187b0b4e196989916ff834758f","planned_action_input_sha256":"2d7df4e2d5e8e7fbec34e1809804ab12ec334e21d470c506907a82acda882505","planned_promotion_operator":{"actor_id":"fixture-ga-promotion-operator-v2","natural_person_identity_ref":{"artifact_id":"fixture-natural-person-build-platform-owner-r1","artifact_path":"valid/natural-person-identity-build-platform-owner.json","artifact_sha256":"31be85a0988f5ae7f529da8e46a986a73c1c5b4cdf45bb41b8ad7c9c9090bcc0","revision":1,"schema":"ylx.natural-person-identity-authority.v1"},"person_id":"fixture-build-platform-owner-person","role_assignment_ref":{"artifact_path":"contracts/fixtures/governance-models/valid/owner-assignment-v2-planning.json","artifact_sha256":"089fd1c73350b99c8a67f96ab2a1241a713ca6decbdf142280e65370a3d2966d","authority_id":"fixture-v2-planning-owner-assignment","revision":1,"verified_at":"2026-06-01T13:00:00Z"},"role_slot":"build-platform-owner"},"pre_release_ref":{"artifact_id":"fixture-pre-release-closure-v2","artifact_path":"contracts/fixtures/governance-models/valid/pre-release-closure-v2.json","artifact_sha256":"b41fa603b57b11c89ad75f8a57c72b2b075eabb1b9c7addf658caf5ab0673350","revision":1,"schema":"ylx.pre-release-closure.v2"},"pre_release_sha256":"b41fa603b57b11c89ad75f8a57c72b2b075eabb1b9c7addf658caf5ab0673350","product_contract_sha256":"fac531853410276fe9ebca29c631a9215222a84642df67e21ec70d2ca820ae11","promotion_plan_ref":{"artifact_id":"fixture-ga-promotion-plan-v2","artifact_path":"contracts/fixtures/governance-models/valid/ga-promotion-plan-v2.json","artifact_sha256":"96a22636287b76284d9cfb4e88fc591513665ef30c1324ee7ec65c7e218eb734","revision":1,"schema":"ylx.ga-promotion-plan.v2"},"promotion_plan_sha256":"96a22636287b76284d9cfb4e88fc591513665ef30c1324ee7ec65c7e218eb734","qualification_governance_contract_sha256":"6c7c2518f163fa3883c22d2bb77fc57d4d10799b5cd1e50862eaf2e11da5a39e","quorum_policy_ref":{"artifact_id":"fixture-release-quorum-policy-v2","artifact_path":"contracts/fixtures/governance-models/valid/release-quorum-policy-v2.json","artifact_sha256":"daf76452ffe912b975168e81eee1d93bf9099cd7e361810ba0e5a32cd7c0ef2c","revision":1,"schema":"ylx.release-quorum-policy.v2"},"quorum_policy_sha256":"daf76452ffe912b975168e81eee1d93bf9099cd7e361810ba0e5a32cd7c0ef2c","quorum_signature_sha256_by_role":{"contract-owner":"76e5fc6ee7eff830320b2ab860cb5acad0bb40502f3d8569c0d080d9d1a2355e","qa-evidence-owner":"10ffecd4a60471e438c27c6c81e0bd66c2b4250cdb07f3f8c951e7de403f311d","release-owner":"4063d349546e71b8b02fc34ba848741e60376f0907037d0221ebad64c18a4917","security-owner":"7be2356db8a4ff1603a06c1d20de6105cd601aedc03225c1a6701ec1d1c9e5ac"},"rc_artifact_sha256":"eb73599b870722c6363d656ff30b3c6de60ce96339208b87cca02d3a1081867a","rc_commit":"1111111111111111111111111111111111111111","rc_version":"0.5.0-rc.1","release_operation_assignment_ref":{"artifact_id":"fixture-release-operation-assignment-v2-promotion","artifact_path":"contracts/fixtures/governance-models/valid/release-operation-assignment-v2-promotion.json","artifact_sha256":"f0974c44654bb917eb68dfd805d451681a61bb25848b95a57d7796297317135b","revision":1,"schema":"ylx.release-operation-assignment.v2"},"release_train":"fixture-release-train-0-5","required_key_validity_horizon_seconds":86400,"revision":1,"role_assignment_by_role":{"contract-owner":{"assignment_ref":{"artifact_id":"fixture-signing-assignment-contract-owner-r1","artifact_path":"contracts/fixtures/governance-models/valid/role-signing-key-assignment-contract-owner.json","artifact_sha256":"a1559d2d0421de9423a6e4505316e03bb6ca4bf1ca1713e47a2a42d0122ec47c","revision":1,"schema":"ylx.role-signing-key-assignment.v1"},"person_id":"fixture-contract-owner-person"},"qa-evidence-owner":{"assignment_ref":{"artifact_id":"fixture-signing-assignment-qa-evidence-owner-r1","artifact_path":"contracts/fixtures/governance-models/valid/role-signing-key-assignment-qa-evidence-owner.json","artifact_sha256":"23b62eb7665df67342b38c829be47400e0501963502ef421995c8f2465e31db4","revision":1,"schema":"ylx.role-signing-key-assignment.v1"},"person_id":"fixture-qa-evidence-owner-person"},"release-owner":{"assignment_ref":{"artifact_id":"fixture-signing-assignment-release-owner-r1","artifact_path":"contracts/fixtures/governance-models/valid/role-signing-key-assignment-release-owner.json","artifact_sha256":"586bc975bbffb25cffa58d192500cf19ff2829b8f614a7e5fcc75f8ade153400","revision":1,"schema":"ylx.role-signing-key-assignment.v1"},"person_id":"fixture-release-owner-person"},"security-owner":{"assignment_ref":{"artifact_id":"fixture-signing-assignment-security-owner-r1","artifact_path":"contracts/fixtures/governance-models/valid/role-signing-key-assignment-security-owner.json","artifact_sha256":"5711be306926fb67c59368bbb47d608470e89688baf22db868b068bdfd21039b","revision":1,"schema":"ylx.role-signing-key-assignment.v1"},"person_id":"fixture-security-owner-person"}},"schema":"ylx.release-publication-fence.v2","signing_policy_ref":{"artifact_id":"fixture-m5-signing-policy-v2","artifact_path":"contracts/fixtures/governance-models/valid/m5-signing-policy-v2.json","artifact_sha256":"07021dc6d06fc913ce8769f46b98a40bf0af01b3ffb15800f8c1479a6d2a2d27","revision":1,"schema":"ylx.m5-signing-policy.v2"},"signing_policy_sha256":"07021dc6d06fc913ce8769f46b98a40bf0af01b3ffb15800f8c1479a6d2a2d27","system_milestone":"0.5"}